training/leelaz_opencl_tuning
0;XgemmBatched;192;256;192;16; -DKWG=32 -DKWI=2 -DMDIMA=8 -DMDIMC=8 -DMWG=32 -DNDIMB=8 -DNDIMC=8 -DNWG=64 -DSA=0 -DSB=0 -DSTRM=0 -DSTRN=0 -DVWM=1 -DVWN=1;OpenCL: NVIDIA Corporation GeForce 820M @ 1250MHz
